opcode       : 06
flags        : 00
rsvd1        : 0000
nsid         : 00000000
cdw2         : 00000000
cdw3         : 00000000
data_len     : 00001000
metadata_len : 00000000
addr         : 5598c7ea7000
metadata     : 0
cdw10        : 00000001
cdw11        : 00000000
cdw12        : 00000000
cdw13        : 00000000
cdw14        : 00000000
cdw15        : 00000000
timeout_ms   : 00000000
result       : 00000000
err          : 0
latency      : 937 us
NVME Identify Controller:
vid       : 0x1987
ssvid     : 0x1987
sn        : 22276M51209820      
mn        : Phison ESMP512GMB47C3-E13TS             
fr        : EDFM90.0
rab       : 1
ieee      : 6479a7
cmic      : 0
  [3:3] : 0	ANA not supported
  [2:2] : 0	PCI
  [1:1] : 0	Single Controller
  [0:0] : 0	Single Port

mdts      : 6
cntlid    : 0x1
ver       : 0x10300
rtd3r     : 0x124f80
rtd3e     : 0x2191c0
oaes      : 0
  [31:31] : 0	Discovery Log Change Notice Not Supported
  [27:27] : 0	Zone Descriptor Changed Notices Not Supported
  [15:15] : 0	Normal NSS Shutdown Event Not Supported
  [14:14] : 0	Endurance Group Event Aggregate Log Page Change Notice Not Supported
  [13:13] : 0	LBA Status Information Notices Not Supported
  [12:12] : 0	Predictable Latency Event Aggregate Log Change Notices Not Supported
  [11:11] : 0	Asymmetric Namespace Access Change Notices Not Supported
  [9:9] : 0	Firmware Activation Notices Not Supported
  [8:8] : 0	Namespace Attribute Changed Event Not Supported

ctratt    : 0
  [19:19] : 0	Flexible Data Placement Not Supported
  [15:15] : 0	Extended LBA Formats Not Supported
  [14:14] : 0	Delete NVM Set Not Supported
  [13:13] : 0	Delete Endurance Group Not Supported
  [12:12] : 0	Variable Capacity Management Not Supported
  [11:11] : 0	Fixed Capacity Management Not Supported
  [10:10] : 0	Multi Domain Subsystem Not Supported
  [9:9] : 0	UUID List Not Supported
  [8:8] : 0	SQ Associations Not Supported
  [7:7] : 0	Namespace Granularity Not Supported
  [6:6] : 0	Traffic Based Keep Alive Not Supported
  [5:5] : 0	Predictable Latency Mode Not Supported
  [4:4] : 0	Endurance Groups Not Supported
  [3:3] : 0	Read Recovery Levels Not Supported
  [2:2] : 0	NVM Sets Not Supported
  [1:1] : 0	Non-Operational Power State Permissive Not Supported
  [0:0] : 0	128-bit Host Identifier Not Supported

rrls      : 0
cntrltype : 0
  [7:2] : 0	Reserved
  [1:0] : 0	Controller type not reported
fguid     : 00000000-0000-0000-0000-000000000000
crdt1     : 0
crdt2     : 0
crdt3     : 0
nvmsr     : 0
  [1:1] : 0	NVM subsystem Not part of an Enclosure
  [0:0] : 0	NVM subsystem Not part of a Storage Device

vwci      : 0
  [7:7] : 0	VPD Write Cycles Remaining field is Not valid.
  [6:0] : 0	VPD Write Cycles Remaining 

mec       : 0
  [1:1] : 0	NVM subsystem Not contains a Management Endpoint on a PCIe port
  [0:0] : 0	NVM subsystem Not contains a Management Endpoint on an SMBus/I2C port

oacs      : 0x17
  [10:10] : 0	Lockdown Command and Feature Not Supported
  [9:9] : 0	Get LBA Status Capability Not Supported
  [8:8] : 0	Doorbell Buffer Config Not Supported
  [7:7] : 0	Virtualization Management Not Supported
  [6:6] : 0	NVMe-MI Send and Receive Not Supported
  [5:5] : 0	Directives Not Supported
  [4:4] : 0x1	Device Self-test Supported
  [3:3] : 0	NS Management and Attachment Not Supported
  [2:2] : 0x1	FW Commit and Download Supported
  [1:1] : 0x1	Format NVM Supported
  [0:0] : 0x1	Security Send and Receive Supported

acl       : 0
aerl      : 3
frmw      : 0x12
  [5:5] : 0	Multiple FW or Boot Update Detection Not Supported
  [4:4] : 0x1	Firmware Activate Without Reset Supported
  [3:1] : 0x1	Number of Firmware Slots
  [0:0] : 0	Firmware Slot 1 Read/Write

lpa       : 0xa
  [6:6] : 0	Telemetry Log Data Area 4 Not Supported
  [5:5] : 0	LID 0x0, Scope of each command in LID 0x5, 0x12, 0x13 Not Supported
  [4:4] : 0	Persistent Event log Not Supported
  [3:3] : 0x1	Telemetry host/controller initiated log page Supported
  [2:2] : 0	Extended data for Get Log Page Not Supported
  [1:1] : 0x1	Command Effects Log Page Supported
  [0:0] : 0	SMART/Health Log Page per NS Not Supported

elpe      : 15
  [7:0] : 15 (0's based)	Error Log Page Entries (ELPE)

npss      : 4
  [7:0] : 4 (0's based)	Number of Power States Support (NPSS)

avscc     : 0x1
  [0:0] : 0x1	Admin Vendor Specific Commands uses NVMe Format

apsta     : 0x1
  [0:0] : 0x1	Autonomous Power State Transitions Supported

wctemp    : 343
 [15:0] : 70 째C (343 K)	Warning Composite Temperature Threshold (WCTEMP)

cctemp    : 353
 [15:0] : 80 째C (353 K)	Critical Composite Temperature Threshold (CCTEMP)

mtfa      : 100
hmpre     : 130247
hmmin     : 529
tnvmcap   : 512,110,190,592
[127:0] : 512,110,190,592
	Total NVM Capacity (TNVMCAP)

unvmcap   : 0
[127:0] : 0
	Unallocated NVM Capacity (UNVMCAP)

rpmbs     : 0
 [31:24]: 0	Access Size
 [23:16]: 0	Total Size
  [5:3] : 0	Authentication Method
  [2:0] : 0	Number of RPMB Units

edstt     : 30
dsto      : 1
fwug      : 4
kas       : 1
hctma     : 0x1
  [0:0] : 0x1	Host Controlled Thermal Management Supported

mntmt     : 273
 [15:0] : 0 째C (273 K)	Minimum Thermal Management Temperature (MNTMT)

mxtmt     : 343
 [15:0] : 70 째C (343 K)	Maximum Thermal Management Temperature (MXTMT)

sanicap   : 0x6
  [31:30] : 0	Additional media modification after sanitize operation completes successfully is not defined
  [29:29] : 0	No-Deallocate After Sanitize bit in Sanitize command Supported
    [2:2] : 0x1	Overwrite Sanitize Operation Supported
    [1:1] : 0x1	Block Erase Sanitize Operation Supported
    [0:0] : 0	Crypto Erase Sanitize Operation Not Supported

hmminds   : 0
hmmaxd    : 0
nsetidmax : 0
endgidmax : 0
anatt     : 0
anacap    : 0
  [7:7] : 0	Non-zero group ID Not Supported
  [6:6] : 0	Group ID does change
  [4:4] : 0	ANA Change state Not Supported
  [3:3] : 0	ANA Persistent Loss state Not Supported
  [2:2] : 0	ANA Inaccessible state Not Supported
  [1:1] : 0	ANA Non-optimized state Not Supported
  [0:0] : 0	ANA Optimized state Not Supported

anagrpmax : 0
nanagrpid : 0
pels      : 0
domainid  : 0
megcap    : 0
sqes      : 0x66
  [7:4] : 0x6	Max SQ Entry Size (64)
  [3:0] : 0x6	Min SQ Entry Size (64)

cqes      : 0x44
  [7:4] : 0x4	Max CQ Entry Size (16)
  [3:0] : 0x4	Min CQ Entry Size (16)

maxcmd    : 0
nn        : 1
oncs      : 0x5e
  [10:10] : 0	All Fast Copy Not Supported
  [9:9] : 0	Copy Single Atomicity Not Supported
  [8:8] : 0	Copy Not Supported
  [7:7] : 0	Verify Not Supported
  [6:6] : 0x1	Timestamp Supported
  [5:5] : 0	Reservations Not Supported
  [4:4] : 0x1	Save and Select Supported
  [3:3] : 0x1	Write Zeroes Supported
  [2:2] : 0x1	Data Set Management Supported
  [1:1] : 0x1	Write Uncorrectable Supported
  [0:0] : 0	Compare Not Supported

fuses     : 0
  [0:0] : 0	Fused Compare and Write Not Supported

fna       : 0x1
  [3:3] : 0	Format NVM Broadcast NSID (FFFFFFFFh) Supported
  [2:2] : 0	Crypto Erase Not Supported as part of Secure Erase
  [1:1] : 0	Crypto Erase Applies to Single Namespace(s)
  [0:0] : 0x1	Format Applies to All Namespace(s)

vwc       : 0x1
  [2:1] : 0	Support for the NSID field set to FFFFFFFFh is not indicated
  [0:0] : 0x1	Volatile Write Cache Present

awun      : 255
awupf     : 0
icsvscc   : 1
  [0:0] : 0x1	NVM Vendor Specific Commands uses NVMe Format

nwpc      : 0
  [2:2] : 0	Permanent Write Protect Not Supported
  [1:1] : 0	Write Protect Until Power Supply Not Supported
  [0:0] : 0	No Write Protect and Write Protect Namespace Not Supported

acwu      : 0
ocfs      : 0
  [3:3] : 0	Controller Copy Format 3h Not Supported
  [2:2] : 0	Controller Copy Format 2h Not Supported
  [1:1] : 0	Controller Copy Format 1h Not Supported
  [0:0] : 0	Controller Copy Format 0h Not Supported

sgls      : 0
 [15:8] : 0	SGL Descriptor Threshold
 [1:0]  : 0	Scatter-Gather Lists Not Supported

mnan      : 0
maxdna    : 0
maxcna    : 0
oaqd      : 0
subnqn    : 
ioccsz    : 0
iorcsz    : 0
icdoff    : 0
fcatt     : 0
  [0:0] : 0	Dynamic Controller Model

msdbd     : 0
ofcs      : 0
  [0:0] : 0	Disconnect command Not Supported

ps      0 : mp:3.50W operational enlat:0 exlat:0 rrt:0 rrl:0
            rwt:0 rwl:0 idle_power:- active_power:-
            active_power_workload:-
ps      1 : mp:1.90W operational enlat:0 exlat:0 rrt:1 rrl:1
            rwt:1 rwl:1 idle_power:- active_power:-
            active_power_workload:-
ps      2 : mp:1.50W operational enlat:0 exlat:0 rrt:2 rrl:2
            rwt:2 rwl:2 idle_power:- active_power:-
            active_power_workload:-
ps      3 : mp:0.0700W non-operational enlat:5000 exlat:1900 rrt:3 rrl:3
            rwt:3 rwl:3 idle_power:- active_power:-
            active_power_workload:-
ps      4 : mp:0.0020W non-operational enlat:13000 exlat:100000 rrt:4 rrl:4
            rwt:4 rwl:4 idle_power:- active_power:-
            active_power_workload:-
vs[]:
       0  1  2  3  4  5  6  7  8  9  a  b  c  d  e  f
0000: 00 00 00 00 00 00 00 00 00 00 00 00 00 00 00 00 "................"
0010: 00 00 00 00 00 00 00 00 00 00 00 00 00 00 00 00 "................"
0020: 00 00 00 00 00 00 00 00 00 00 00 00 00 00 00 00 "................"
0030: 00 00 00 00 00 00 00 00 00 00 00 00 00 00 00 00 "................"
0040: 00 00 00 00 00 00 00 00 00 00 00 00 00 00 00 00 "................"
0050: 00 00 00 00 00 00 00 00 00 00 00 00 00 00 00 00 "................"
0060: 00 00 00 00 00 00 00 00 00 00 00 00 00 00 00 00 "................"
0070: 00 00 00 00 00 00 00 00 00 00 00 00 00 00 00 00 "................"
0080: 00 00 00 00 00 00 00 00 00 00 00 00 00 00 00 00 "................"
0090: 00 00 00 00 00 00 00 00 00 00 00 00 00 00 00 00 "................"
00a0: 00 00 00 00 00 00 00 00 00 00 00 00 00 00 00 00 "................"
00b0: 00 00 00 00 00 00 00 00 00 00 00 00 00 00 00 00 "................"
00c0: 00 00 00 00 00 00 00 00 00 00 00 00 00 00 00 00 "................"
00d0: 00 00 00 00 00 00 00 00 00 00 00 00 00 00 00 00 "................"
00e0: 00 00 00 00 00 00 00 00 00 00 00 00 00 00 00 00 "................"
00f0: 00 00 00 00 00 00 00 00 00 00 00 00 00 00 00 00 "................"
0100: 00 00 00 00 00 00 00 00 00 00 00 00 00 00 00 00 "................"
0110: 00 00 00 00 00 00 00 00 00 00 00 00 00 00 00 00 "................"
0120: 00 00 00 00 00 00 00 00 00 00 00 00 00 00 00 00 "................"
0130: 00 00 00 00 00 00 00 00 00 00 00 00 00 00 00 00 "................"
0140: 00 00 00 00 00 00 00 00 00 00 00 00 00 00 00 00 "................"
0150: 00 00 00 00 00 00 00 00 00 00 00 00 00 00 00 00 "................"
0160: 00 00 00 00 00 00 00 00 00 00 00 00 00 00 00 00 "................"
0170: 00 00 00 00 00 00 00 00 00 00 00 00 00 00 00 00 "................"
0180: 00 00 00 00 00 00 00 00 00 00 00 00 00 00 00 00 "................"
0190: 00 00 00 00 00 00 00 00 00 00 00 00 00 00 00 00 "................"
01a0: 00 00 00 00 00 00 00 00 00 00 00 00 00 00 00 00 "................"
01b0: 00 00 00 00 00 00 00 00 00 00 00 00 00 00 00 00 "................"
01c0: 00 00 00 00 00 00 00 00 00 00 00 00 00 00 00 00 "................"
01d0: 00 00 00 00 00 00 00 00 00 00 00 00 00 00 00 00 "................"
01e0: 00 00 00 00 00 00 00 00 00 00 00 00 00 00 00 00 "................"
01f0: 00 00 00 00 00 00 00 00 00 00 00 00 00 00 00 00 "................"
0200: 00 00 00 00 00 00 00 00 00 00 00 00 00 00 00 00 "................"
0210: 00 00 00 00 00 00 00 00 00 00 00 00 00 00 00 00 "................"
0220: 00 00 00 00 00 00 00 00 00 00 00 00 00 00 00 00 "................"
0230: 00 00 00 00 00 00 00 00 00 00 00 00 00 00 00 00 "................"
0240: 00 00 00 00 00 00 00 00 00 00 00 00 00 00 00 00 "................"
0250: 00 00 00 00 00 00 00 00 00 00 00 00 00 00 00 00 "................"
0260: 00 00 00 00 00 00 00 00 00 00 00 00 00 00 00 00 "................"
0270: 00 00 00 00 00 00 00 00 00 00 00 00 00 00 00 00 "................"
0280: 00 00 00 00 00 00 00 00 00 00 00 00 00 00 00 00 "................"
0290: 00 00 00 00 00 00 00 00 00 00 00 00 00 00 00 00 "................"
02a0: 00 00 00 00 00 00 00 00 00 00 00 00 00 00 00 00 "................"
02b0: 00 00 00 00 00 00 00 00 00 00 00 00 00 00 00 00 "................"
02c0: 00 00 00 00 00 00 00 00 00 00 00 00 00 00 00 00 "................"
02d0: 00 00 00 00 00 00 00 00 00 00 00 00 00 00 00 00 "................"
02e0: 00 00 00 00 00 00 00 00 00 00 00 00 00 00 00 00 "................"
02f0: 00 00 00 00 00 00 00 00 00 00 00 00 00 00 00 00 "................"
0300: 00 00 00 00 00 00 00 00 00 00 00 00 00 00 00 00 "................"
0310: 00 00 00 00 00 00 00 00 00 00 00 00 00 00 00 00 "................"
0320: 00 00 00 00 00 00 00 00 00 00 00 00 00 00 00 00 "................"
0330: 00 00 00 00 00 00 00 00 00 00 00 00 00 00 00 00 "................"
0340: 00 00 00 00 00 00 00 00 00 00 00 00 00 00 00 00 "................"
0350: 00 00 00 00 00 00 00 00 00 00 00 00 00 00 00 00 "................"
0360: 00 00 00 00 00 00 00 00 00 00 00 00 00 00 00 00 "................"
0370: 00 00 00 00 00 00 00 00 00 00 00 00 00 00 00 00 "................"
0380: 00 00 00 00 00 00 00 00 00 00 00 00 00 00 00 00 "................"
0390: 00 00 00 00 00 00 00 00 00 00 00 00 00 00 00 00 "................"
03a0: 00 00 00 00 00 00 00 00 00 00 00 00 00 00 00 00 "................"
03b0: 00 00 00 00 00 00 00 00 00 00 00 00 00 00 00 00 "................"
03c0: 00 00 00 00 00 00 00 00 00 00 00 00 00 00 00 00 "................"
03d0: 00 00 00 00 00 00 00 00 00 00 00 00 00 00 00 00 "................"
03e0: 00 00 00 00 00 00 00 00 00 00 00 00 00 00 00 00 "................"
03f0: 00 00 00 00 00 00 00 00 00 00 00 00 00 00 00 00 "................"
